820_As-built,8200CCG485,"Shift Temp.Cofferdam  & Remove Piles: P8",TT_Task,,"Removal of Piles: P4 to P6 & P7 &P8",17-Dec-2012,14-Jan-2013,28,07-Nov-2011,02-Dec-2011,25,-406,-3,-10.71,,,,,1,2
820_As-built,8200CCG490,"Fill Lean Concrete & Reinstate BottomSlab for P8",TT_Task,,"Removal of Piles: P4 to P6 & P7 &P8",17-Jan-2013,19-Jan-2013,2,03-Dec-2011,07-Dec-2011,4,-411,2,100.00,,,,,3,3
820_As-built,8200CCG400a,"Working Platform for Prebore H Piles",TT_Task,,"Removal of Piles: P4 to P6 & P7 &P8",21-Jun-2011,14-Jul-2011,23,07-Apr-2011,05-May-2011,28,-75,5,21.74,,,,,4,3
820_As-built,8200CCG440a,"Slew 400kV Cable to P1 to P3",TT_Task,,"Removal of Piles: P4 to P6 & P7 &P8",06-Feb-2012,16-Feb-2012,10,19-Sep-2011,01-Oct-2011,12,-140,2,20.00,,,,,1,2
820_As-built,8200CCG440b,"Divert Watermain (FW203)",TT_Task,,"Removal of Piles: P4 to P6 & P7 &P8",20-Feb-2012,25-Feb-2012,5,01-Oct-2011,21-Oct-2011,20,-142,15,300.00,,,,,2,3
820_As-built,8200sum640,"WD1Pre-bored Socket H-piles & Pile Cap (5nos..)",TT_LOE,,"Removal of Piles: P4 to P6 & P7 &P8",21-Jun-2011,23-Oct-2011,124,07-Apr-2011,09-Aug-2011,124,-75,0,0.00,,,,,1,1
820_As-built,8200sum642,"WD1 Piles Removal (P4,P6,P7 & P8) (UT)",TT_LOE,,"Removal of Piles: P4 to P6 & P7 &P8",13-Apr-2012,19-Jan-2013,281,13-Oct-2011,07-Dec-2011,55,-183,-226,-80.43,,,,,1,1
820_As-built,8200CCG420a,"Bulk Excqavation to Expose Top Slab of Culvert",TT_Task,,"Removal of Piles: P4 to P6 & P7 &P8",21-Jun-2011,02-Jul-2011,11,20-Jun-2011,02-Jul-2011,12,-1,1,9.09,,,,,1,2
820_As-built,8200CCG420b,"Place Concrete Block Wall",TT_Task,,"Removal of Piles: P4 to P6 & P7 &P8",21-Jun-2011,22-Jun-2011,1,20-Jun-2011,22-Jun-2011,2,-1,1,100.00,,,,,1,1
820_As-built,8200CCG420c,"Waling Installtion",TT_Task,,"Removal of Piles: P4 to P6 & P7 &P8",31-Aug-2011,21-Sep-2011,21,05-Jul-2011,23-Jul-2011,18,-57,-3,-14.29,,,,,2,1
820_As-built,8200CCG438,"Concrete Curing",TT_Task,,"Removal of Piles: P4 to P6 & P7 &P8",28-Jan-2012,24-Feb-2012,27,09-Sep-2011,07-Oct-2011,28,-141,1,3.70,,,,,1,1
820_As-built,8200CCG439,"Installation of Jacks",TT_Task,,"Removal of Piles: P4 to P6 & P7 &P8",25-Feb-2012,03-Mar-2012,7,07-Oct-2011,14-Oct-2011,7,-141,0,0.00,,,,,1,1
820_As-built,8200CCG440c,"Water Suspension & Connection",TT_Task,,"Removal of Piles: P4 to P6 & P7 &P8",25-Feb-2012,02-Mar-2012,6,21-Oct-2011,28-Oct-2011,7,-127,1,16.67,,,,,1,1
820_As-built,8200CCG440d,"Backfilling",TT_Task,,"Removal of Piles: P4 to P6 & P7 &P8",02-Mar-2012,08-Mar-2012,6,28-Oct-2011,04-Nov-2011,7,-126,1,16.67,,,,,1,1
820_As-built,8200CCG445,"Excavation to Expose P4 to P8",TT_Task,,"Removal of Piles: P4 to P6 & P7 &P8",08-Mar-2012,21-Mar-2012,13,04-Nov-2011,18-Nov-2011,14,-125,1,7.69,,,,,2,2
820_As-built,8200CCG447,"Installation of Concrete Block Wall",TT_Task,,"Removal of Piles: P4 to P6 & P7 &P8",21-Mar-2012,11-Apr-2012,21,18-Nov-2011,05-Dec-2011,17,-124,-4,-19.05,,,,,1,1
820_As-built,8200CCG495,"Shift Temp.Cofferdam  & Remove Piles: P6",TT_Task,,"Removal of Piles: P4 to P6 & P7 &P8",05-Jan-2013,04-Feb-2013,30,19-Nov-2011,20-Dec-2011,31,-413,1,3.33,,,,,1,2
820_As-built,8200CCG590,"Fill Lean Concrete & Reinstate BottomSlab for P6",TT_Task,,"Removal of Piles: P4 to P6 & P7 &P8",02-Feb-2013,05-Feb-2013,3,21-Dec-2011,24-Dec-2011,3,-409,0,0.00,,,,,2,1
820_As-built,8200CCG595,"Shift Temp.Cofferdam  & Remove Piles: P7",TT_Task,,"Removal of Piles: P4 to P6 & P7 &P8",21-Jan-2013,01-Feb-2013,11,23-Dec-2011,09-Jan-2012,17,-395,6,54.55,,,,,1,1
820_As-built,8200CCG610,"Fill Lean Concrete & Reinstate BottomSlab for P7",TT_Task,,"Removal of Piles: P4 to P6 & P7 &P8",25-Feb-2013,27-Feb-2013,2,10-Jan-2012,13-Jan-2012,3,-412,1,50.00,,,,,2,1
820_As-built,8200CCG410,"Install 5 nos.Pre-bored Socket H-piles",TT_Task,,"Removal of Piles: P4 to P6 & P7 &P8",21-Jun-2011,12-Jul-2011,21,06-May-2011,28-May-2011,22,-46,1,4.76,,,,,4,2
820_As-built,8200CCG420,"Sheet Pile for Cofferdam",TT_Task,,"Removal of Piles: P4 to P6 & P7 &P8",22-Jul-2011,18-Aug-2011,27,30-May-2011,28-Jun-2011,29,-53,2,7.41,,,,,4,5
820_As-built,8200CCG425,"Blinding Slab",TT_Task,,"Removal of Piles: P4 to P6 & P7 &P8",31-Aug-2011,02-Sep-2011,2,25-Jul-2011,27-Jul-2011,2,-37,0,0.00,,,,,4,1
820_As-built,8200CCG430,"Demolish TopSlab above PilesP1~ P3 &  P9",TT_Task,,"Removal of Piles: P4 to P6 & P7 &P8",31-Aug-2011,14-Sep-2011,14,04-Jul-2011,16-Jul-2011,12,-58,-2,-14.29,,,,,1,2
820_As-built,8200DSG150,"Prepare Temp.Gate & Working Platform Proposal",TT_Task,,"Temp.works Design Submission",28-Feb-2011,26-Apr-2011,57,12-May-2010,07-Jul-2010,56,-292,-1,-1.75,,,,,1,1
820_As-built,8200DSG155,"Comment of Temp.Gate& Working Platform byRDO/DSD",TT_Task,,"Temp.works Design Submission",12-Apr-2011,17-Apr-2011,5,08-Jul-2010,13-Jul-2010,5,-278,0,0.00,,,,,1,1
820_As-built,8200DSG160,"Proposed Temp.Gate & Working Platform Re-subm'n",TT_Task,,"Temp.works Design Submission",11-May-2011,02-Jun-2011,22,14-Jul-2010,05-Aug-2010,22,-301,0,0.00,,,,,1,1
820_As-built,8200DSG165,"Proposed Temp.Gate& WorkingPlatf'mApp'l /RDO&DSD",TT_Task,,"Temp.works Design Submission",25-May-2011,01-Aug-2011,68,06-Aug-2010,13-Oct-2010,68,-292,0,0.00,,,,,1,1
820_As-built,8200DSG220,"Prepare & Submit Utilities Diversion Scheme",TT_Task,,"Utilities Coordination",28-Feb-2011,31-Mar-2011,31,12-May-2010,14-Jun-2010,33,-292,2,6.45,,,,,1,1
820_As-built,8200DSG225,"Comment of Utilities Diversion Scheme",TT_Task,,"Utilities Coordination",01-Apr-2011,28-Apr-2011,27,15-Jun-2010,12-Jul-2010,27,-290,0,0.00,,,,,1,1
820_As-built,8200DSG230,"Utilities Diversion Scheme Re-submission",TT_Task,,"Utilities Coordination",29-Apr-2011,14-May-2011,15,13-Jul-2010,26-Jul-2010,13,-290,-2,-13.33,,,,,1,1
820_As-built,8200DSG235,"Utilities Diversion Scheme Approval",TT_Task,,"Utilities Coordination",15-May-2011,30-Jun-2011,46,27-Jul-2010,11-Sep-2010,46,-292,0,0.00,,,,,1,1
820_As-built,8200DSG240,"Preparation Excavation Permit",TT_Task,,"Utilities Coordination",11-Apr-2011,10-Jun-2011,60,28-Jun-2010,21-Aug-2010,54,-287,-6,-10.00,,,,,1,1
820_As-built,8200DSG245,"Excavation Permit Issue",TT_Mile,,"Utilities Coordination",13-Jun-2011,13-Jun-2011,0,21-Aug-2010,21-Aug-2010,,-296,,,,,,,1,1
820_As-built,8200DSG200,"Culvert New Founding System Approval by RDO/DSD",TT_Task,,"Proposed Culvert New Founding System",08-Jun-2011,27-Jul-2011,49,21-Dec-2010,08-Feb-2011,49,-169,0,0.00,,,,,1,1
820_As-built,8200DSG185,"Prepare & Submit Culvert New Founding System",TT_Task,,"Proposed Culvert New Founding System",28-Feb-2011,11-Mar-2011,11,29-Jul-2010,10-Aug-2010,12,-214,1,9.09,,,,,1,1
820_As-built,8200DSG190,"Comment of Culvert New Founding System byRDO/DSD",TT_Task,,"Proposed Culvert New Founding System",12-Apr-2011,26-Apr-2011,14,11-Aug-2010,25-Aug-2010,14,-244,0,0.00,,,,,1,1
820_As-built,8200DSG195,"Culvert New Founding System Re-submission",TT_Task,,"Proposed Culvert New Founding System",24-May-2011,27-Sep-2011,126,20-Aug-2010,24-Dec-2010,126,-277,0,0.00,,,,,1,1
820_As-built,8200CCG115,"Remove Temp.300mm dia.Fresh Water Meter (FW203)",TT_Task,,"Power Cable & Fresh Water Main",11-Oct-2012,25-Oct-2012,14,11-Oct-2012,25-Oct-2012,14,0,0,0.00,,,,,1,1
820_As-built,8200CCG120,"Remove Temp.Support for Temp.Fresh Water Main",TT_Task,,"Power Cable & Fresh Water Main",25-Oct-2012,31-Oct-2012,6,25-Oct-2012,31-Oct-2012,6,0,0,0.00,,,,,1,2
820_As-built,8200CCG045,"GI works for WD1",TT_Task,,"Power Cable & Fresh Water Main",08-Jan-2011,01-Jun-2011,144,21-Sep-2010,07-Feb-2011,139,-109,-5,-3.47,,,,,1,2
820_As-built,8200CCG050,"Site Mobilization",TT_Task,,"Power Cable & Fresh Water Main",07-Jun-2011,06-Jul-2011,29,18-Aug-2010,16-Sep-2010,29,-293,0,0.00,,,,,1,1
820_As-built,8200CCG055,"Temp.Working Platform",TT_Task,,"Power Cable & Fresh Water Main",23-Jun-2011,23-Aug-2011,61,02-Sep-2010,02-Nov-2010,61,-294,0,0.00,,,,,3,1
820_As-built,8200CCG060,"Temp.Traffic Diversion(Pedestrian Walkway)",TT_Task,,"Power Cable & Fresh Water Main",28-Feb-2011,11-Mar-2011,11,01-Sep-2010,15-Sep-2010,14,-180,3,27.27,,,,,1,2
820_As-built,8200CCG065,"Trial Trench & Record",TT_Task,,"Power Cable & Fresh Water Main",13-Jun-2011,20-Aug-2011,68,20-Sep-2010,24-Nov-2010,65,-266,-3,-4.41,,,,,2,1
820_As-built,8200CCG070,"Slew 400KV Cable(CLP204)& 2Sets of 11KV(CLP205)",TT_Task,,"Power Cable & Fresh Water Main",02-Jul-2011,10-Oct-2011,100,25-Sep-2010,29-Dec-2010,95,-280,-5,-5.00,,,,,1,1
820_As-built,8200CCG075,"Slew Tele Cables (PCCW204+HKBN201)",TT_Task,,"Power Cable & Fresh Water Main",24-Aug-2011,29-Aug-2011,5,30-Dec-2010,07-Jan-2011,8,-237,3,60.00,,,,,1,3
820_As-built,8200CCG090,"Cosnt.Temp.300mm dia.WaterMain (FW203)",TT_Task,,"Power Cable & Fresh Water Main",20-Feb-2012,27-Mar-2012,36,12-Sep-2011,21-Oct-2011,39,-161,3,8.33,,,,,2,1
820_As-built,8200CCG095,"Water Main Diversion (FW203)",TT_Mile,,"Power Cable & Fresh Water Main",16-Jan-2012,16-Jan-2012,0,21-Oct-2011,21-Oct-2011,,-87,,,,,,,1,1
820_As-built,8200CCG100,"Slew 400KV & 2 Sets 11KV Cables Reinstatement",TT_Task,,"Power Cable & Fresh Water Main",01-Sep-2012,17-Oct-2012,46,01-Sep-2012,17-Oct-2012,46,0,0,0.00,,,,,1,1
820_As-built,8200CCG105,"Remove Temp.Support for 400KV &11KV Cables",TT_Task,,"Power Cable & Fresh Water Main",17-Oct-2012,31-Oct-2012,14,17-Oct-2012,31-Oct-2012,14,0,0,0.00,,,,,1,1
820_As-built,8200CCG110,"Reinstate 300mmdia Fresh Water Main (FW203)",TT_Task,,"Power Cable & Fresh Water Main",01-Sep-2012,10-Oct-2012,39,01-Sep-2012,10-Oct-2012,39,0,0,0.00,,,,,1,1
820_As-built,8200CCG176,"Installation of by-pass pipe, benching & Inspection",TT_Task,,"1.1m Dia. Sewer Pipe Diversion",08-Oct-2012,15-Oct-2012,7,21-Feb-2012,28-Feb-2012,7,-230,0,0.00,,,,,1,1
820_As-built,8200CCG179,"Grouting for MH-2",TT_Task,,"1.1m Dia. Sewer Pipe Diversion",16-Jan-2012,28-Jan-2012,12,30-Dec-2011,11-Jan-2012,12,-17,0,0.00,,,,,2,2
820_As-built,8200CCG182,"Construct MH-2 Stage 1 & pump test",TT_Task,,"1.1m Dia. Sewer Pipe Diversion",04-Oct-2012,15-Oct-2012,11,17-Feb-2012,28-Feb-2012,11,-230,0,0.00,,,,,2,1
820_As-built,8200CCG183,"Insert DN800 temp pipe and fill gap between temp pipe & DN1800",TT_Task,,"1.1m Dia. Sewer Pipe Diversion",16-Oct-2012,20-Oct-2012,4,29-Feb-2012,05-Mar-2012,5,-230,1,25.00,,,,,1,1
820_As-built,8200CCG180,"Excavate for dewatering well and place blinding",TT_Task,,"1.1m Dia. Sewer Pipe Diversion",16-Jan-2012,20-Jan-2012,4,12-Jan-2012,17-Jan-2012,5,-4,1,25.00,,,,,1,1
820_As-built,8200CCG184,"Installation of by-pass pipe, benching & Inspection",TT_Task,,"1.1m Dia. Sewer Pipe Diversion",20-Oct-2012,29-Oct-2012,9,05-Mar-2012,12-Mar-2012,7,-229,-2,-22.22,,,,,1,1
820_As-built,8200CCG187,"Diversion",TT_Task,,"1.1m Dia. Sewer Pipe Diversion",30-Oct-2012,02-Nov-2012,3,15-Mar-2012,19-Mar-2012,4,-229,1,33.33,,,,,3,1
820_As-built,8200CCG185,"Excavate for pipe laying between MH-1 to MH-2 & Shoring Installation",TT_Task,,"1.1m Dia. Sewer Pipe Diversion",06-Mar-2012,19-Apr-2012,44,14-Jan-2012,24-Feb-2012,41,-52,-3,-6.82,,,,,1,1
820_As-built,8200CCG186,"Pipe Laying, air test and concrete surround",TT_Task,,"1.1m Dia. Sewer Pipe Diversion",12-Oct-2012,26-Oct-2012,14,25-Feb-2012,09-Mar-2012,13,-230,-1,-7.14,,,,,1,1
820_As-built,8200CCG178,"Drilling",TT_Task,,"1.1m Dia. Sewer Pipe Diversion",16-Jan-2012,21-Jan-2012,5,20-Dec-2011,29-Dec-2011,9,-27,4,80.00,,,,,0,2
820_As-built,8200CCG188,"Backfill to 2nd layer waling and construct remaining part of manholes MH-1 & MH-2",TT_Task,,"1.1m Dia. Sewer Pipe Diversion",02-Nov-2012,20-Nov-2012,18,16-Jul-2012,06-Sep-2012,52,-109,34,188.89,,,,,1,1
820_As-built,8200CCG189,"Remove 1st layer waling and backfill to ground level",TT_Task,,"1.1m Dia. Sewer Pipe Diversion",21-Nov-2012,24-Nov-2012,3,18-Aug-2012,21-Aug-2012,3,-95,0,0.00,,,,,1,1
820_As-built,8200CCG192,"Install Casing & Remove Piles (4nos at U/T)",TT_Task,,"1.1m Dia. Sewer Pipe Diversion",11-Jan-2013,01-Mar-2013,49,28-Aug-2012,20-Oct-2012,53,-136,4,8.16,,,,,1,2
820_As-built,8200CCG135,"Coord'n w/DSD forTemp.Removal ofOverflow Pipe",TT_FinMile,,"1.1m Dia. Sewer Pipe Diversion",16-Jan-2012,16-Jan-2012,0,23-Sep-2011,23-Sep-2011,,-115,,,,,,,2,1
820_As-built,8200CCG140,"Trial Trench & Record",TT_Task,,"1.1m Dia. Sewer Pipe Diversion",31-Aug-2011,30-Sep-2011,30,18-Apr-2011,17-May-2011,29,-135,-1,-3.33,,,,,5,3
820_As-built,8200CCG145,"Sheet Piles Cofferdam 1A",TT_Task,,"1.1m Dia. Sewer Pipe Diversion",22-Jul-2011,03-Oct-2011,73,18-May-2011,30-Jul-2011,73,-65,0,0.00,,,,,1,4
820_As-built,8200CCG150,"Expose and Protect 400mm dia.Gas Main (GAS211)",TT_Task,,"1.1m Dia. Sewer Pipe Diversion",08-Sep-2011,11-Oct-2011,33,01-Aug-2011,30-Aug-2011,29,-38,-4,-12.12,,,,,2,2
820_As-built,8200CCG151,"Drilling",TT_Task,,"1.1m Dia. Sewer Pipe Diversion",16-Jan-2012,31-Jan-2012,15,10-Nov-2011,23-Nov-2011,13,-67,-2,-13.33,,,,,1,2
820_As-built,8200CCG156,"Excavate for MH-1 Construction & Shoring Installation",TT_Task,,"1.1m Dia. Sewer Pipe Diversion",01-Mar-2012,24-Mar-2012,23,06-Jan-2012,02-Feb-2012,27,-55,4,17.39,,,,,2,1
820_As-built,8200CCG152,"Grouting for MH-1",TT_Task,,"1.1m Dia. Sewer Pipe Diversion",16-Jan-2012,21-Jan-2012,5,20-Dec-2011,29-Dec-2011,9,-27,4,80.00,,,,,2,2
820_As-built,8200CCG172,"Construct MH-1 Stage 1 & pump test",TT_Task,,"1.1m Dia. Sewer Pipe Diversion",17-Sep-2012,28-Sep-2012,11,03-Feb-2012,14-Feb-2012,11,-227,0,0.00,,,,,2,1
820_As-built,8200CCG181,"Excavate for MH-2 Construction & Shoring Installation",TT_Task,,"1.1m Dia. Sewer Pipe Diversion",16-Jan-2012,17-Feb-2012,32,14-Jan-2012,16-Feb-2012,33,-2,1,3.13,,,,,2,2
820_As-built,8200CCG174,"Insert DN800 temp pipe and fill gap between temp pipe & DN1800",TT_Task,,"1.1m Dia. Sewer Pipe Diversion",29-Sep-2012,06-Oct-2012,7,15-Feb-2012,20-Feb-2012,5,-227,-2,-28.57,,,,,1,3
820_As-built,8200CCG190,"Install Casing & Remove Piles (3nos at D/T)",TT_Task,,"1.1m Dia. Sewer Pipe Diversion",26-Nov-2012,24-Dec-2012,28,29-Mar-2012,08-May-2012,40,-242,12,42.86,,,,,1,3
820_As-built,8200CCG210,"Backfilling & Reinstate Road Surface",TT_Task,,"1.1m Dia. Sewer Pipe Diversion",23-Nov-2012,07-Jan-2013,45,22-Oct-2012,21-Dec-2013,425,-32,380,844.44,,,,,3,4
820_As-built,8200sum610,"Obstruction Removal at 1.1m Dia.Sewer Pipe Area (DT)",TT_LOE,,"1.1m Dia. Sewer Pipe Diversion",22-Jul-2011,18-Apr-2012,271,18-May-2011,31-Mar-2012,318,-65,47,17.34,,,,,1,0
820_As-built,8200sum610a,"Obstruction Removal at 1.1m Dia.Sewer Pipe Area (UT)",TT_LOE,,"1.1m Dia. Sewer Pipe Diversion",14-Dec-2010,14-Dec-2010,0,14-Dec-2010,07-Dec-2012,724,0,,,,,,,0,0
820_As-built,8200CCG153,"Excavate for dewatering well and place blinding",TT_Task,,"1.1m Dia. Sewer Pipe Diversion",16-Jan-2012,19-Jan-2012,3,30-Dec-2011,05-Jan-2012,6,-17,3,100.00,,,,,0,1
820_As-built,8200y1000,"Underpinning Works for FS1 / Barrettes Removal",TT_LOE,,"Box Culvert FS1 Barrettes Removal",31-Aug-2011,06-Dec-2011,97,18-Apr-2011,11-Nov-2011,207,-135,110,113.40,,,,,1,3
820_As-built,8200MTG270,"MS Preparation",TT_Task,,"Method Statement Submission and Approval",28-Feb-2011,30-Mar-2011,30,30-Jul-2010,30-Aug-2010,31,-213,1,3.33,,,,,1,1
820_As-built,8200MTG275,"MS Submission to MTR",TT_FinMile,,"Method Statement Submission and Approval",26-Mar-2011,26-Mar-2011,0,30-Aug-2010,30-Aug-2010,,-208,,,,,,,1,1
820_As-built,8200MTG280,"MS Comment by MTR/DSD",TT_Task,,"Method Statement Submission and Approval",27-Mar-2011,22-Apr-2011,26,01-Sep-2010,27-Sep-2010,26,-207,0,0.00,,,,,1,2
820_As-built,8200MTG285,"MS Re-submission Preparation",TT_Task,,"Method Statement Submission and Approval",26-Apr-2011,28-May-2011,32,30-Jul-2010,30-Aug-2010,31,-270,-1,-3.13,,,,,1,2
820_As-built,8200MTG290,"MS Submission to MTR",TT_FinMile,,"Method Statement Submission and Approval",18-May-2011,18-May-2011,0,30-Aug-2010,30-Aug-2010,,-261,,,,,,,2,1
820_As-built,8200MTG295,"MS Comment & Approval by MTR/DSD",TT_Task,,"Method Statement Submission and Approval",19-May-2011,14-Jun-2011,26,01-Sep-2010,27-Sep-2010,26,-260,0,0.00,,,,,1,1
820_As-built,8200MTG300,"Issue for Construction",TT_FinMile,,"Method Statement Submission and Approval",15-Jun-2011,15-Jun-2011,0,27-Sep-2010,27-Sep-2010,,-261,,,,,,,2,1
820_As-built,8200CCG980,"Steel Beam Installation underneath Corbel Beams & Connect to H-pile",TT_Task,,"Underpinning Works for FS1",31-Aug-2011,06-Sep-2011,6,25-Jul-2011,29-Jul-2011,4,-37,-2,-33.33,,,,,1,1
820_As-built,8200CCG985,"Loading Transfer with Jacks",TT_Task,,"Underpinning Works for FS1",31-Aug-2011,31-Aug-2011,0,30-Jul-2011,02-Aug-2011,3,-32,,,,,,,2,1
820_As-built,8200CCG995,"Backfilling, Compaction & Testing",TT_Task,,"Underpinning Works for FS1",11-Jul-2015,05-Aug-2015,25,,,,0,,,11-Jul-2015,05-Aug-2015,28-Oct-2015,20-Nov-2015,3,1
820_As-built,8200CCG998,"Disconnected Steel H-pile inside Tunnel Box",TT_Task,,"Underpinning Works for FS1",06-Aug-2015,13-Aug-2015,7,,,,0,,,06-Aug-2015,13-Aug-2015,21-Nov-2015,27-Nov-2015,1,1
820_As-built,8200CCG990,"Excavation to foundation level for B14",TT_Task,,"Underpinning Works for FS1",17-Feb-2012,16-Jun-2012,120,15-Jul-2011,09-Nov-2011,117,-217,-3,-2.50,,,,,1,1
820_As-built,8200CCG994,"Install Lagging Wall (at West & East D-wall)",TT_Task,,"Underpinning Works for FS1",31-Aug-2011,11-Nov-2011,72,17-Aug-2011,11-Nov-2011,86,-14,14,19.44,,,,,2,1
820_As-built,8200CCG946,"Area 39.1 Tree Transplant by 801 Designated Contractor",TT_FinMile,,"Underpinning Works for FS1",06-May-2011,06-May-2011,0,06-May-2011,06-May-2011,,0,,,,,,,1,0
820_As-built,8200CCG987,"Excavation to foundation level for B19",TT_Task,,"Underpinning Works for FS1",31-Aug-2011,16-Dec-2011,107,15-Jul-2011,04-Nov-2011,112,-47,5,4.67,,,,,1,2
820_As-built,8200CCG992,"Barettes Breaking (B15-B18)",TT_Task,,"Underpinning Works for FS1",31-Aug-2011,14-Dec-2011,105,15-Jul-2011,02-Nov-2011,110,-47,5,4.76,,,,,1,0
820_As-built,8200CCG950,"Soft Excavation to S1 (~+4.5mPD)",TT_Task,,"Underpinning Works for FS1",18-Oct-2011,21-Oct-2011,3,28-May-2011,02-Jun-2011,5,-143,2,66.67,,,,,0,1
820_As-built,8200CCG955,"Soft Excavation & Expose Culvert FS1(~-2.0mPD)",TT_Task,,"Underpinning Works for FS1",31-Aug-2011,14-Sep-2011,14,02-Jun-2011,02-Jul-2011,30,-90,16,114.29,,,,,1,1
820_As-built,8200CCG960,"Cast in-situ RC Wall to Support Existing Ground (adjacent B14 & B19)",TT_Task,,"Underpinning Works for FS1",31-Aug-2011,05-Sep-2011,5,14-Jun-2011,22-Jun-2011,8,-78,3,60.00,,,,,2,1
820_As-built,8200CCG965,"Setup & Install Four Prebored H-piles (adjacent to Existing B17)",TT_Task,,"Underpinning Works for FS1",31-Aug-2011,15-Sep-2011,15,18-Apr-2011,07-May-2011,19,-135,4,26.67,,,,,3,3
820_As-built,8200CCG970,"Soft Excavation to 2m underneath Culvert",TT_Task,,"Underpinning Works for FS1",06-Sep-2011,19-Sep-2011,13,07-Jul-2011,14-Jul-2011,7,-61,-6,-46.15,,,,,2,1
820_As-built,8200CCG975,"Installation of Corbel Beams either Side of Culvert",TT_Task,,"Underpinning Works for FS1",31-Aug-2011,06-Sep-2011,6,15-Jul-2011,24-Jul-2011,9,-47,3,50.00,,,,,1,1
820_As-built,8200DSG405,"Temp. Works Design Submit to MTR",TT_FinMile,,"Temp. Works Design Submission",28-Mar-2011,28-Mar-2011,0,07-Jul-2010,07-Jul-2010,,-264,,,,,,,1,2
820_As-built,8200DSG410,"Temp. Works Design Comment by MTR/DSD",TT_Task,,"Temp. Works Design Submission",28-Mar-2011,11-Apr-2011,14,08-Jul-2010,22-Jul-2010,14,-263,0,0.00,,,,,2,2
820_As-built,8200DSG415,"Temp. Works Design Re-submission Preparation",TT_Task,,"Temp. Works Design Submission",26-Apr-2011,14-May-2011,18,22-Jul-2010,07-Aug-2010,16,-278,-2,-11.11,,,,,1,2
820_As-built,8200DSG420,"Temp. Works Design Comment & Approval by MTR/DSD",TT_Task,,"Temp. Works Design Submission",19-May-2011,17-Jul-2011,59,07-Aug-2010,05-Oct-2010,59,-285,0,0.00,,,,,2,1
820_As-built,8200DSG425,"Issue for Construction",TT_FinMile,,"Temp. Works Design Submission",15-Jun-2011,15-Jun-2011,0,05-Oct-2010,05-Oct-2010,,-253,,,,,,,2,1
820_As-built,8200DSG400,"Temp. Works Design Preparation",TT_Task,,"Temp. Works Design Submission",28-Feb-2011,13-Apr-2011,44,24-May-2010,07-Jul-2010,44,-280,0,0.00,,,,,1,1
820_As-built,8200CCG999a,"Prepare & Submit Draft As-built Drawings",TT_Task,,"Completion",14-Aug-2015,10-Sep-2015,27,,,,0,,,14-Aug-2015,10-Sep-2015,28-Nov-2015,28-Dec-2015,1,1
820_As-built,8200CCG999b,"Prepare & Submit As-built Drawings",TT_Task,,"Completion",11-Sep-2015,10-Oct-2015,29,,,,0,,,11-Sep-2015,10-Oct-2015,29-Dec-2015,26-Jan-2016,1,1
820_As-built,8200y930,"Rising Main & FMO Pier A Pile Removal (DT)",TT_LOE,,"G5 Rising Main Diversion & FMO Pier A Pile Remvoal",13-Mar-2011,05-Jan-2013,664,20-Aug-2010,25-Nov-2011,462,-205,-202,-30.42,,,,,1,3
820_As-built,8200y940,"Rising Main & FMO Pier A Pile Removal (UT)",TT_LOE,,"G5 Rising Main Diversion & FMO Pier A Pile Remvoal",13-Mar-2011,07-Sep-2013,909,20-Aug-2010,25-Nov-2011,462,-205,-447,-49.17,,,,,1,3
820_As-built,8200CCG613,"Expose Existing North Pipe",TT_Task,,"Construction",14-Mar-2011,06-Dec-2011,267,18-Feb-2011,11-Mar-2011,21,-24,-246,-92.13,,,,,3,2
820_As-built,8200CCG525,"GI works for Rising Main Pile Removal",TT_Task,,"Construction",28-Feb-2011,19-Mar-2011,19,29-Jul-2010,19-Aug-2010,21,-214,2,10.53,,,,,1,1
820_As-built,8200CCG530,"Trial Trench for Existing Utilities",TT_Task,,"Construction",19-Apr-2011,18-May-2011,29,30-Jul-2010,23-Aug-2010,24,-263,-5,-17.24,,,,,2,1
820_As-built,8200CCG535,"Slew Telecom Cable (PCCW702+CATV704)",TT_Task,,"Construction",30-Apr-2011,12-May-2011,12,18-Sep-2010,28-Sep-2010,10,-224,-2,-16.67,,,,,2,1
820_As-built,8200CCG540,"Ground Treatment for Existing Seawall, if any",TT_Task,,"Construction",17-May-2011,25-May-2011,8,22-Sep-2010,29-Sep-2010,7,-237,-1,-12.50,,,,,2,1
820_As-built,8200CCG545,"Sheetpile Installation",TT_Task,,"Construction",21-May-2011,04-Jun-2011,14,20-Aug-2010,04-Sep-2010,15,-274,1,7.14,,,,,3,6
820_As-built,8200CCG550,"Northern Rising Main: Install Prebored H-pile (10nos.)",TT_Task,,"Construction",14-Jun-2011,23-Jul-2011,39,20-Sep-2010,28-Oct-2010,38,-267,-1,-2.56,,,,,3,4
820_As-built,8200CCG555,"Southern Rising Main: install Prebored H-pile (10nos.)",TT_Task,,"Construction",14-Jun-2011,23-Jul-2011,39,20-Sep-2010,28-Oct-2010,38,-267,-1,-2.56,,,,,1,2
820_As-built,8200CCG560,"Pile Testing",TT_Task,,"Construction",01-Aug-2011,06-Aug-2011,5,22-Oct-2010,28-Oct-2010,6,-283,1,20.00,,,,,2,2
820_As-built,8200CCG565,"Excavate & Expose Bottom of Rising Main (Trial Trench)",TT_Task,,"Construction",01-Aug-2011,22-Aug-2011,21,11-Oct-2010,30-Oct-2010,19,-294,-2,-9.52,,,,,3,3
820_As-built,8200CCG567,"Locate Existing Rising Main & FMO (A) Piles",TT_Task,,"Construction",08-Aug-2011,20-Aug-2011,12,28-Oct-2010,08-Nov-2010,11,-284,-1,-8.33,,,,,1,1
820_As-built,8200CCG578,"North Temp.Rising Main:Capping Beam",TT_Task,,"Construction",07-Oct-2011,29-Oct-2011,22,10-Dec-2010,06-Jan-2011,27,-301,5,22.73,,,,,3,2
820_As-built,8200CCG580,"South Temp.Rising Main:Capping Beam",TT_Task,,"Construction",07-Oct-2011,29-Oct-2011,22,10-Dec-2010,06-Jan-2011,27,-301,5,22.73,,,,,3,1
820_As-built,8200CCG600,"South Temp.Rising Main Installation+Thrust Block",TT_Task,,"Construction",31-Oct-2011,12-Nov-2011,12,07-Jan-2011,20-Jan-2011,13,-297,1,8.33,,,,,2,4
820_As-built,8200CCG605,"Notification for South Rising Main & Flow Stop from DSD Station",TT_FinMile,,"Construction",12-Nov-2011,12-Nov-2011,0,10-Jan-2011,10-Jan-2011,,-306,,,,,,,1,1
820_As-built,8200CCG608,"Diversion Works for  Rising Main (South Pipe)",TT_Task,,"Construction",28-Feb-2011,11-Mar-2011,11,21-Jan-2011,02-Feb-2011,12,-38,1,9.09,,,,,3,2
820_As-built,8200CCG628,"Form WorkingPlatform",TT_Task,,"Construction",21-Jun-2011,21-Jul-2011,30,28-Mar-2011,14-May-2011,47,-85,17,56.67,,,,,1,1
820_As-built,8200CCG1010,"Cofferdam Reinstatement",TT_Task,,"Construction",29-Mar-2014,19-Jun-2014,82,29-Mar-2014,10-May-2014,42,0,-40,-48.78,,,,,1,3
820_As-built,8200CCG615,"Notification for North Rising Main & Flow Stop from DSD Station",TT_FinMile,,"Construction",15-Dec-2011,15-Dec-2011,0,17-Feb-2011,17-Feb-2011,,-301,,,,,,,1,1
820_As-built,8200CCG620,"Diversion Works for Rising Main (North Pipe)",TT_Task,,"Construction",01-Nov-2011,11-Nov-2011,10,12-Mar-2011,23-Mar-2011,11,-234,1,10.00,,,,,4,2
820_As-built,8200CCG625,"Dismantle Existing Rising Mains",TT_Task,,"Construction",12-Nov-2011,18-Nov-2011,6,24-Mar-2011,30-Mar-2011,6,-233,0,0.00,,,,,1,3
820_As-built,8200CCG630,"Locate Existing Rising Main & FMO (A) Piles",TT_Task,,"Construction",21-Jun-2011,21-Jul-2011,30,16-May-2011,21-Jun-2011,36,-36,6,20.00,,,,,5,3
820_As-built,8200CCG635,"Removal FMO Pier A Raking Piles DT & Backfilling",TT_Task,,"Construction",31-Aug-2011,14-Nov-2011,75,18-Apr-2011,30-Jul-2011,103,-135,28,37.33,,,,,4,2
820_As-built,8200CCG640,"Remove Rising Mains Vertical Piles Clash D/T Tunnel & Backfilling",TT_Task,,"Construction",31-Aug-2011,22-Dec-2011,113,01-Aug-2011,25-Nov-2011,116,-30,3,2.65,,,,,4,4
820_As-built,8200CCG645,"Removal FMO Pier A Raking Piles UT & Backfilling",TT_Task,,"Construction",29-Oct-2011,08-May-2012,192,18-Apr-2011,01-Aug-2011,105,-194,-87,-45.31,,,,,4,2
820_As-built,8200CCG650,"Remove Rising Main Vertical Piles Clash U/T Tunnel & Backfilling",TT_Task,,"Construction",30-Nov-2011,22-Mar-2012,113,02-Aug-2011,25-Nov-2011,115,-120,2,1.77,,,,,4,1
820_As-built,8200CCG655,"Remove Working Platform",TT_Task,,"Construction",17-Apr-2012,03-May-2012,16,26-Nov-2011,09-Dec-2011,13,-143,-3,-18.75,,,,,1,2
820_As-built,8200CCG660,"Tie Beams Construction for New Rising Main",TT_Task,,"Construction",16-Jan-2012,27-Feb-2012,42,10-Dec-2011,21-Jan-2012,42,-37,0,0.00,,,,,1,1
820_As-built,8200CCG675,"Reinstatement Works for Rising Mains (South pipe)",TT_Task,,"Construction",01-Nov-2013,31-Dec-2013,60,30-Oct-2013,18-Dec-2013,49,-2,-11,-18.33,,,,,1,3
820_As-built,8200CCG668,"Notification for South Rising Main & Flow Stop from DSD Station",TT_FinMile,,"Construction",07-Oct-2013,07-Oct-2013,0,07-Oct-2013,07-Oct-2013,,0,,,,,,,1,1
820_As-built,8200sum650,"Rising Main & FMO Pier A Pile Removal (DT)",TT_LOE,,"Construction",13-Mar-2011,05-Jan-2013,664,20-Aug-2010,25-Nov-2011,462,-205,-202,-30.42,,,,,1,3
